{
  "$schema": "./templates.schema.json",
  "version": "2.0",
  "author": "ifq-design-skills",
  "description": "IFQ Design Skills · built-in HTML templates with ambient IFQ cues already woven into layout rhythm, metadata, local-first typography, and colophon logic. Agents should Read the template before generating, then fork-and-fill with subject matter instead of blank-starting.",
  "modeRoutes": [
    {
      "mode": "M-01",
      "templateId": "T-launch-film",
      "triggers": ["launch film", "发布会动画", "产品片头", "motion demo", "launch opener", "product video"],
      "required_assets": ["logo", "product_image_or_key_visual", "timeline"],
      "verify_command": "npm run verify:lite -- <file.html>",
      "example_prompt": "24 秒硬件发布片头，冷静，像 Teenage Engineering，不要发布会预热。",
      "fallback_note": "Use T-hero-landing as keyposter scaffold if T-launch-film is too specific."
    },
    {
      "mode": "M-02",
      "templateId": "T-hero-landing",
      "triggers": ["个人站", "portfolio", "about me", "personal site"],
      "required_assets": ["name", "positioning", "current_work"],
      "verify_command": "npm run verify:lite -- <file.html>",
      "example_prompt": "个人站一页，但不要像找工作。"
    },
    {
      "mode": "M-03",
      "templateId": "T-infographic-vertical",
      "triggers": ["白皮书", "report", "PDF 报告", "annual report"],
      "required_assets": ["outline", "sections", "source_notes"],
      "verify_command": "npm run verify:lite -- <file.html>",
      "example_prompt": "把这份研究整理成一页可打印白皮书。"
    },
    {
      "mode": "M-04",
      "templateId": "T-dashboard",
      "triggers": ["dashboard", "command center", "KPI", "看板"],
      "required_assets": ["metrics", "entities", "states"],
      "verify_command": "npm run verify:lite -- <file.html>",
      "example_prompt": "内部 AI 做一个 command center，像 Bloomberg 终端，不要 BI 套壳。"
    },
    {
      "mode": "M-05",
      "templateId": "T-compare-vs",
      "triggers": ["A vs B", "benchmark", "横评", "对比评测"],
      "required_assets": ["subjects", "criteria", "evidence"],
      "verify_command": "npm run verify:lite -- <file.html>",
      "example_prompt": "把这两个产品做成一页对比评测。"
    },
    {
      "mode": "M-06",
      "templateId": "T-onboarding-flow",
      "triggers": ["onboarding", "新手引导", "flow demo", "可交互流程", "first run", "guided setup"],
      "required_assets": ["screen_list", "primary_flow", "interaction_points"],
      "verify_command": "npm run verify:lite -- <file.html>",
      "example_prompt": "做一个 5 屏 onboarding flow demo。",
      "fallback_note": "Use T-hero-landing as flow cover scaffold if T-onboarding-flow is too specific."
    },
    {
      "mode": "M-07",
      "templateId": "T-changelog",
      "triggers": ["changelog", "release notes", "发布日记", "更新记录"],
      "required_assets": ["release_items", "dates", "impact_notes"],
      "verify_command": "npm run verify:lite -- <file.html>",
      "example_prompt": "这周 4 个更新，做成纵向 changelog，要像活页笔记，别像公告栏。"
    },
    {
      "mode": "M-08",
      "templateId": "T-slide-title",
      "triggers": ["keynote", "PPT", "slide deck", "演讲"],
      "required_assets": ["talk_title", "audience", "section_outline"],
      "verify_command": "npm run verify:lite -- <file.html>",
      "example_prompt": "明天沙龙讲 AI agent 20 分钟，给我一份 deck，不要像 SaaS keynote。"
    },
    {
      "mode": "M-09",
      "templateId": "T-social-x",
      "triggers": ["社媒物料", "social cover", "小红书", "X card"],
      "required_assets": ["message", "audience", "platform_size"],
      "verify_command": "npm run verify:lite -- <file.html>",
      "example_prompt": "把这条发布说明做成一张 X/Twitter 分享卡。"
    },
    {
      "mode": "M-10",
      "templateId": "T-business-card",
      "triggers": ["名片", "business card", "邀请函", "VIP card"],
      "required_assets": ["name_or_title", "contact", "print_constraints"],
      "verify_command": "npm run verify:lite -- <file.html>",
      "example_prompt": "朋友独立咖啡店名片，黑白双面，不要花，要有手工感。"
    },
    {
      "mode": "M-11",
      "templateId": "T-brand-diagnosis",
      "triggers": ["品牌诊断", "brand audit", "品牌体检", "upgrade direction", "brand critique"],
      "required_assets": ["current_brand", "competitors", "diagnosis_criteria"],
      "verify_command": "npm run verify:lite -- <file.html>",
      "example_prompt": "帮这个品牌做一次体检，给 3 个升级方向。",
      "fallback_note": "Use T-compare-vs as audit board if T-brand-diagnosis is too specific."
    },
    {
      "mode": "M-12",
      "templateId": "T-brand-system",
      "triggers": ["brand from scratch", "从零建立品牌", "brand system", "全栈品牌系统", "visual identity"],
      "required_assets": ["positioning", "name", "applications"],
      "verify_command": "npm run verify:lite -- <file.html>",
      "example_prompt": "从零建立一个 AI 工具品牌系统，含落地页和社媒物料。",
      "fallback_note": "Use T-hero-landing as landing page scaffold if T-brand-system is too specific."
    }
  ],
  "templates": [
    {
      "id": "T-hero-landing",
      "mode": ["M-02", "M-12"],
      "name": "Editorial Hero Landing",
      "file": "assets/templates/hero-landing.html",
      "viewport": "1440×900",
      "notes": "IFQ-native hero scaffold with rust ledger, sparkle cue, quiet colophon, and editorial header rhythm."
    },
    {
      "id": "T-slide-title",
      "mode": ["M-08"],
      "name": "Keynote Title Slide",
      "file": "assets/templates/slide-title.html",
      "viewport": "1920×1080",
      "notes": "IFQ keynote title slide with field-note stamp area, spark cluster, and rust divider."
    },
    {
      "id": "T-dashboard",
      "mode": ["M-04"],
      "name": "Command Center Dashboard",
      "file": "assets/templates/dashboard-command-center.html",
      "viewport": "1440×900",
      "notes": "Left nav + KPI strip + 3×3 metric grid + quiet IFQ live-system footer. Uses hand-drawn radar/arrow icons."
    },
    {
      "id": "T-infographic-vertical",
      "mode": ["M-03", "M-07"],
      "name": "Vertical Infographic (小红书长图)",
      "file": "assets/templates/infographic-vertical.html",
      "viewport": "1242×3200",
      "notes": "Multi-section scroll with timeline, pull-quotes, and IFQ field-note footer treatment."
    },
    {
      "id": "T-social-x",
      "mode": ["M-09"],
      "name": "X/Twitter Share Card",
      "file": "assets/templates/social-x-card.html",
      "viewport": "1200×675",
      "notes": "IFQ social card with rust ledger, spark cue, and authored bottom line."
    },
    {
      "id": "T-compare-vs",
      "mode": ["M-05"],
      "name": "A vs B Comparison Matrix",
      "file": "assets/templates/compare-vs.html",
      "viewport": "1440×900",
      "notes": "IFQ comparison sheet with radar footer and field-research metadata."
    },
    {
      "id": "T-changelog",
      "mode": ["M-07"],
      "name": "Changelog Timeline",
      "file": "assets/templates/changelog-timeline.html",
      "viewport": "1200×variable",
      "notes": "Release ledger with mono dates, rust timeline spine, and IFQ-authored footer."
    },
    {
      "id": "T-business-card",
      "mode": ["M-10"],
      "name": "Business Card (90×54mm + 3mm bleed)",
      "file": "assets/templates/business-card.html",
      "viewport": "96×60mm",
      "notes": "IFQ business card scaffold with spark cue, quiet URL, and authored back colophon."
    },
    {
      "id": "T-launch-film",
      "mode": ["M-01"],
      "name": "Launch Film Timeline",
      "file": "assets/templates/launch-film.html",
      "viewport": "1440×900",
      "notes": "Stage+Sprite launch film scaffold with shot timeline, keyposter slot, spec strip, and export path. Rust ledger spine anchors the timeline."
    },
    {
      "id": "T-onboarding-flow",
      "mode": ["M-06"],
      "name": "Onboarding Flow Demo",
      "file": "assets/templates/onboarding-flow.html",
      "viewport": "1440×900",
      "notes": "Multi-screen onboarding flow with progress stepper, screen cards, user-mind annotations, and tracking hooks. Progress bar uses rust ledger as flow spine."
    },
    {
      "id": "T-brand-diagnosis",
      "mode": ["M-11"],
      "name": "Brand Diagnosis Report",
      "file": "assets/templates/brand-diagnosis.html",
      "viewport": "1440×900",
      "notes": "Six-dimension scoring matrix, Keep/Fix/Quick Wins triage, and three upgrade directions with moodboard slots. Score bars use brand color semantics."
    },
    {
      "id": "T-brand-system",
      "mode": ["M-12"],
      "name": "Brand System Spec",
      "file": "assets/templates/brand-system.html",
      "viewport": "1440×900",
      "notes": "Full brand identity page: logo variants, color palette with WCAG, typography scale, 6 application examples, and spacing system. Rust ledger anchors sections."
    }
  ]
}
